[
  {
    "id": "review-skill",
    "action_id": "review-skill",
    "title": "发起技能治理评审",
    "scenario": "skill_governance",
    "status": "active",
    "target_entity_type": "skill",
    "allowed_actor_types": [
      "ai_agent",
      "human"
    ],
    "required_policy_ids": [
      "policy-read-governance",
      "policy-propose-skill-review"
    ],
    "input_contract": {
      "required": [
        "skill_id",
        "review_scope",
        "evidence_refs"
      ],
      "optional": [
        "risk_notes",
        "candidate_actions"
      ]
    },
    "output_contract": {
      "required": [
        "review_id",
        "summary",
        "candidate_actions"
      ]
    },
    "writeback_targets": [
      "canonical/entities/review_runs.json",
      "derived/reports/governance-overview.md"
    ],
    "requires_human_approval": false,
    "source_ref": "/Users/liming/Documents/codex-ai-gua-jia-01/specs/action-catalog-v0.json",
    "confidence": 0.96,
    "updated_at": "2026-03-14T21:48:39+08:00"
  },
  {
    "id": "resolve-action",
    "action_id": "resolve-action",
    "title": "处理技能治理动作候选",
    "scenario": "skill_governance",
    "status": "active",
    "target_entity_type": "review_run",
    "allowed_actor_types": [
      "ai_agent",
      "human"
    ],
    "required_policy_ids": [
      "policy-read-governance",
      "policy-resolve-review-action"
    ],
    "input_contract": {
      "required": [
        "review_id",
        "candidate_action_id",
        "resolution"
      ],
      "optional": [
        "decision_summary",
        "evidence_refs"
      ]
    },
    "output_contract": {
      "required": [
        "decision_id",
        "resolution_state"
      ]
    },
    "writeback_targets": [
      "canonical/entities/tasks.json",
      "canonical/entities/threads.json",
      "canonical/entities/review_runs.json"
    ],
    "requires_human_approval": true,
    "source_ref": "/Users/liming/Documents/codex-ai-gua-jia-01/specs/action-catalog-v0.json",
    "confidence": 0.96,
    "updated_at": "2026-03-14T21:48:39+08:00"
  },
  {
    "id": "publish-governance-report",
    "action_id": "publish-governance-report",
    "title": "发布治理总览衍生报告",
    "scenario": "skill_governance",
    "status": "active",
    "target_entity_type": "asset",
    "allowed_actor_types": [
      "ai_agent",
      "human"
    ],
    "required_policy_ids": [
      "policy-read-governance",
      "policy-publish-derived-report"
    ],
    "input_contract": {
      "required": [
        "report_scope",
        "source_entity_refs",
        "evidence_refs"
      ],
      "optional": [
        "decision_id",
        "report_path"
      ]
    },
    "output_contract": {
      "required": [
        "asset_id",
        "writeback_id",
        "verification_state"
      ]
    },
    "writeback_targets": [
      "derived/reports/governance-overview.md",
      "canonical/entities/assets.json"
    ],
    "requires_human_approval": true,
    "source_ref": "/Users/liming/Documents/codex-ai-gua-jia-01/specs/action-catalog-v0.json",
    "confidence": 0.96,
    "updated_at": "2026-03-14T21:48:39+08:00"
  },
  {
    "id": "lead-capture",
    "action_id": "lead-capture",
    "title": "录入销售线索",
    "scenario": "skill_governance",
    "status": "active",
    "target_entity_type": "sales_lead",
    "allowed_actor_types": [
      "ai_agent",
      "human"
    ],
    "required_policy_ids": [
      "policy-read-business",
      "policy-execute-sales-action"
    ],
    "input_contract": {
      "required": [
        "lead_id",
        "component_domain",
        "evidence_refs"
      ],
      "optional": [
        "source_channel",
        "owner_mode"
      ]
    },
    "output_contract": {
      "required": [
        "task_id",
        "next_action",
        "writeback_event_type"
      ]
    },
    "writeback_targets": [
      "canonical/entities/tasks.json",
      "work/ai-da-guan-jia/artifacts/ai-da-guan-jia/strategy/current/execute-sales-v1.json"
    ],
    "requires_human_approval": false,
    "source_ref": "/Users/liming/Documents/codex-ai-gua-jia-01/specs/action-catalog-v0.json",
    "confidence": 0.96,
    "updated_at": "2026-03-14T21:48:39+08:00"
  },
  {
    "id": "opportunity-qualify",
    "action_id": "opportunity-qualify",
    "title": "判定商机是否成立",
    "scenario": "skill_governance",
    "status": "active",
    "target_entity_type": "sales_opportunity",
    "allowed_actor_types": [
      "ai_agent",
      "human"
    ],
    "required_policy_ids": [
      "policy-read-business",
      "policy-execute-sales-action"
    ],
    "input_contract": {
      "required": [
        "opportunity_id",
        "qualification_signal",
        "evidence_refs"
      ],
      "optional": [
        "priority_band",
        "owner_mode"
      ]
    },
    "output_contract": {
      "required": [
        "decision_summary",
        "success_state",
        "writeback_event_type"
      ]
    },
    "writeback_targets": [
      "canonical/entities/decision_records.json",
      "work/ai-da-guan-jia/artifacts/ai-da-guan-jia/strategy/current/execute-sales-v1.json"
    ],
    "requires_human_approval": false,
    "source_ref": "/Users/liming/Documents/codex-ai-gua-jia-01/specs/action-catalog-v0.json",
    "confidence": 0.96,
    "updated_at": "2026-03-14T21:48:39+08:00"
  },
  {
    "id": "proposal-quote",
    "action_id": "proposal-quote",
    "title": "形成报价与方案",
    "scenario": "skill_governance",
    "status": "active",
    "target_entity_type": "sales_quote",
    "allowed_actor_types": [
      "ai_agent",
      "human"
    ],
    "required_policy_ids": [
      "policy-read-business",
      "policy-execute-sales-action"
    ],
    "input_contract": {
      "required": [
        "quote_id",
        "opportunity_id",
        "evidence_refs"
      ],
      "optional": [
        "price_band",
        "required_human_approval"
      ]
    },
    "output_contract": {
      "required": [
        "quote_status",
        "next_action",
        "writeback_event_type"
      ]
    },
    "writeback_targets": [
      "canonical/entities/tasks.json",
      "work/ai-da-guan-jia/artifacts/ai-da-guan-jia/strategy/current/execute-sales-v1.json"
    ],
    "requires_human_approval": true,
    "source_ref": "/Users/liming/Documents/codex-ai-gua-jia-01/specs/action-catalog-v0.json",
    "confidence": 0.96,
    "updated_at": "2026-03-14T21:48:39+08:00"
  },
  {
    "id": "deal-commit",
    "action_id": "deal-commit",
    "title": "推动成交承诺",
    "scenario": "skill_governance",
    "status": "active",
    "target_entity_type": "sales_deal",
    "allowed_actor_types": [
      "ai_agent",
      "human"
    ],
    "required_policy_ids": [
      "policy-read-business",
      "policy-execute-sales-action"
    ],
    "input_contract": {
      "required": [
        "deal_id",
        "commit_signal",
        "evidence_refs"
      ],
      "optional": [
        "risk_notes",
        "owner_mode"
      ]
    },
    "output_contract": {
      "required": [
        "deal_stage",
        "next_action",
        "writeback_event_type"
      ]
    },
    "writeback_targets": [
      "canonical/entities/tasks.json",
      "canonical/entities/decision_records.json"
    ],
    "requires_human_approval": false,
    "source_ref": "/Users/liming/Documents/codex-ai-gua-jia-01/specs/action-catalog-v0.json",
    "confidence": 0.96,
    "updated_at": "2026-03-14T21:48:39+08:00"
  },
  {
    "id": "deal-close",
    "action_id": "deal-close",
    "title": "确认成交结果",
    "scenario": "skill_governance",
    "status": "active",
    "target_entity_type": "sales_deal",
    "allowed_actor_types": [
      "ai_agent",
      "human"
    ],
    "required_policy_ids": [
      "policy-read-business",
      "policy-execute-sales-action"
    ],
    "input_contract": {
      "required": [
        "deal_id",
        "close_state",
        "evidence_refs"
      ],
      "optional": [
        "loss_reason",
        "handoff_required"
      ]
    },
    "output_contract": {
      "required": [
        "deal_result",
        "writeback_event_type",
        "next_action"
      ]
    },
    "writeback_targets": [
      "canonical/entities/writeback_events.json",
      "work/ai-da-guan-jia/artifacts/ai-da-guan-jia/strategy/current/execute-sales-v1.json"
    ],
    "requires_human_approval": true,
    "source_ref": "/Users/liming/Documents/codex-ai-gua-jia-01/specs/action-catalog-v0.json",
    "confidence": 0.96,
    "updated_at": "2026-03-14T21:48:39+08:00"
  },
  {
    "id": "post-close-handoff",
    "action_id": "post-close-handoff",
    "title": "完成成交后交接",
    "scenario": "skill_governance",
    "status": "active",
    "target_entity_type": "sales_handoff",
    "allowed_actor_types": [
      "ai_agent",
      "human"
    ],
    "required_policy_ids": [
      "policy-read-business",
      "policy-execute-sales-action"
    ],
    "input_contract": {
      "required": [
        "deal_id",
        "handoff_state",
        "evidence_refs"
      ],
      "optional": [
        "delivery_owner",
        "finance_owner"
      ]
    },
    "output_contract": {
      "required": [
        "handoff_result",
        "writeback_event_type",
        "next_action"
      ]
    },
    "writeback_targets": [
      "canonical/entities/tasks.json",
      "canonical/entities/threads.json"
    ],
    "requires_human_approval": false,
    "source_ref": "/Users/liming/Documents/codex-ai-gua-jia-01/specs/action-catalog-v0.json",
    "confidence": 0.96,
    "updated_at": "2026-03-14T21:48:39+08:00"
  }
]
